<mol:codegen class="ScintillAxGUIBuilder" 
               xmlns="urn:mol-codegen" 
               xmlns:mol="urn:mol-codegen" 
               xmlns:xs="http://www.w3.org/2001/XMLSchema" 
			         xmlns:xsi='http://www.w3.org/2001/XMLSchema-instance'
			         xsi:schemaLocation='urn:mol-codegen resource.xsd'>
 
  
   
  <!-- main GUI description -->
  <ui >

    <!-- the scintilla ax ctrl -->
    <window name="ScintillaActiveXControl" class="ScintillAx"
            layout="FillLayout" pos="stdRect"  >
      

      <!-- child window holding native scintilla widget -->
      <window name="editor" id="IDC_EDITOR_VIEW" class="EditWnd" pos="mol::stdRect"
              visible="true" layout="" >
		    <set member="UsePopUp">true</set>          
		    <set member="CodePage">CP_UTF8</set>          
		    <set member="ScrollWidth">120</set>          
		    <set member="MarginWidth">1,0</set>          
		    <set member="TabWidth">4</set>
	    </window>
    
    </window>
  
  </ui>



</mol:codegen>

